<?xml version="1.0" encoding="UTF-8"?>
<tns:patch closeOnSuccess="true" retryOnFail="false" xmlns:tns="http://docs.ampdev.net/schemas/xmlpatcher" xmlns:xsi="http://www.w3.org/2001/XMLSchema-instance" xsi:schemaLocation="http://docs.ampdev.net/schemas/xmlpatcher ../../schemas/xmlpatcher.xsd ">
  <jira>AMP-17885</jira>
  <keyword>cleanup</keyword>
  <author>Diego</author> 
  <description>Change the stateblog datatype from amp_map_state</description>
  <apply>
    <script>
      <lang delimiter=";" type="postgres">
      		<!-- adding "IF EXISTS" check, but also configure to retryOnFail=false for PostgreSQL versions < 9.2 -->
			ALTER TABLE IF EXISTS amp_map_state ALTER COLUMN stateblob TYPE text;
      </lang>
    </script>
  </apply>
</tns:patch>