<?xml version="1.0" encoding="UTF-8"?>
<tns:patch closeOnSuccess="false" retryOnFail="true"
	xmlns:tns="http://docs.ampdev.net/schemas/xmlpatcher" xmlns:xsi="http://www.w3.org/2001/XMLSchema-instance"
	xsi:schemaLocation="http://docs.ampdev.net/schemas/xmlpatcher ../doc/xmlpatcher.xsd ">
	<jira>AMP-17836</jira>
	<keyword>Views</keyword>
	<author>Constantin Dolghier</author>
	<description>recreate view, this will always be the last version of the view</description>
	<trigger type="all">
		<condition type="custom">
			<script returnVar="val">
				<lang type="sql">
					SELECT settingsvalue FROM amp_global_settings where settingsname='Recreate the views on the next server restart';
				</lang>
			</script>
 			<test>val.equalsIgnoreCase("true")</test>
		</condition>
	</trigger> 
	<apply>
		<script>
			<lang delimiter=";" type="postgres">
				DROP VIEW IF EXISTS v_mondrian_activity_texts;
				CREATE OR REPLACE VIEW v_mondrian_activity_texts AS
					SELECT aav.amp_activity_id, aav.name, aav.approval_status, aav.amp_id FROM amp_activity_version aav;
			</lang>
		</script>
	</apply>
</tns:patch>
