<?xml version="1.0" encoding="UTF-8"?>
<tns:patch closeOnSuccess="true" retryOnFail="true"
    xmlns:tns="http://docs.ampdev.net/schemas/xmlpatcher" xmlns:xsi="http://www.w3.org/2001/XMLSchema-instance"
    xsi:schemaLocation="http://docs.ampdev.net/schemas/xmlpatcher ../doc/xmlpatcher.xsd ">
    <jira>AMP-24675</jira>
    <keyword>change text Mulitple</keyword>
    <author>apicca</author>
    <description>Change text for "Mulitple" in dg_message</description>
    <apply>
        <script>
            <lang delimiter=";" type="postgres">

                update dg_message set message_utf8 = 'Multiple Projects', orig_message = 'Multiple Projects' where message_key = '653829648' and lang_iso = 'en';
                update dg_message set message_utf8 = 'Múltiples Proyectos', orig_message = 'Múltiples Proyectos' where message_key = '653829648' and lang_iso = 'es';

                update dg_message set message_utf8 = 'Multiple Projects', orig_message = 'Multiple Projects' where message_key = '-61985588' and lang_iso = 'en';
                update dg_message set message_utf8 = 'Múltiples Proyectos', orig_message = 'Múltiples Proyectos' where message_key = '-61985588' and lang_iso = 'es';

            </lang>
        </script>
    </apply>
</tns:patch>
