<?xml version="1.0" encoding="UTF-8"?>
<tns:patch closeOnSuccess="false" retryOnFail="true"
	xmlns:tns="http://docs.ampdev.net/schemas/xmlpatcher" xmlns:xsi="http://www.w3.org/2001/XMLSchema-instance"
	xsi:schemaLocation="http://docs.ampdev.net/schemas/xmlpatcher ../doc/xmlpatcher.xsd ">
	<jira>AMP-14167</jira>
	<keyword>Views</keyword>
	<author>Alexandru Artimon</author>
	<description>recreate view, this will always be the last version of the view</description>
	<trigger type="all">
		<condition type="custom">
			<script returnVar="val">
				<lang type="sql">
					SELECT settingsvalue FROM amp_global_settings where settingsname='Recreate the views on the next server restart';
				</lang>
			</script>
 			<test>val.equalsIgnoreCase("true")</test>
		</condition>
	</trigger> 
	<apply>
		<script>
			<lang delimiter=";" type="postgres">
			    	CREATE OR REPLACE VIEW v_donor_type AS
			    		SELECT vd.amp_activity_id, orgtype.org_type, orgtype.amp_org_type_id AS org_type_id 
			    			FROM v_donors vd 
								JOIN amp_organisation org ON org.amp_org_id = vd.amp_donor_org_id
								JOIN amp_org_group orggroup ON orggroup.amp_org_grp_id = org.org_grp_id
								JOIN amp_org_type orgtype ON orgtype.amp_org_type_id = orggroup.org_type;
        		</lang>
		</script>
	</apply>
</tns:patch>
