<?xml version="1.0" encoding="UTF-8"?>
<tns:patch closeOnSuccess="false" retryOnFail="true"
	xmlns:tns="http://docs.ampdev.net/schemas/xmlpatcher" xmlns:xsi="http://www.w3.org/2001/XMLSchema-instance"
	xsi:schemaLocation="http://docs.ampdev.net/schemas/xmlpatcher ../doc/xmlpatcher.xsd ">
	<jira>AMP-14167</jira>
	<keyword>Views</keyword>
	<author>Alexandru Artimon</author>
	<description>recreate view, this will always be the last version of the view</description>
	<trigger type="all">
		<condition type="custom">
			<script returnVar="val">
				<lang type="sql">
					SELECT settingsvalue FROM amp_global_settings where settingsname='Recreate the views on the next server restart';
				</lang>
			</script>
 			<test>val.equalsIgnoreCase("true")</test>
		</condition>
	</trigger> 
	<apply>
		<script>
			<lang delimiter=";" type="postgres">
				DROP VIEW IF EXISTS v_budget_program;
				CREATE OR REPLACE VIEW v_budget_program AS 
			    	SELECT a.amp_activity_id, (prog.theme_code::text || ' - '::text) || prog.name::text AS budget_program, prog.amp_theme_id, prog.name AS progname, prog.theme_code 
			    		FROM amp_activity_version a
			    			JOIN amp_theme prog ON a.budget_program = prog.amp_theme_id;
        		</lang>
		</script>
	</apply>
</tns:patch>
