<?xml version="1.0" encoding="UTF-8"?>
<tns:patch closeOnSuccess="false" retryOnFail="true"
	xmlns:tns="http://docs.ampdev.net/schemas/xmlpatcher" xmlns:xsi="http://www.w3.org/2001/XMLSchema-instance"
	xsi:schemaLocation="http://docs.ampdev.net/schemas/xmlpatcher ../doc/xmlpatcher.xsd ">
	<jira>AMP-14167</jira>
	<keyword>Views</keyword>
	<author>Alexandru Artimon</author>
	<description>recreate view, this will always be the last version of the view</description>
	<trigger type="all">
		<condition type="custom">
			<script returnVar="val">
				<lang type="sql">
					SELECT settingsvalue FROM amp_global_settings where settingsname='Recreate the views on the next server restart';
				</lang>
			</script>
 			<test>val.equalsIgnoreCase("true")</test>
		</condition>
	</trigger> 
	<apply>
		<script>
			<lang delimiter=";" type="postgres">
			    	CREATE OR REPLACE VIEW v_g_settings_currency AS 
			    		SELECT amp_currency.currency_code AS id, amp_currency.currency_name AS value FROM amp_currency WHERE (amp_currency.active_flag = 1) AND (NOT amp_currency.virtual_flag) ORDER BY amp_currency.currency_name;
        		</lang>
		</script>
	</apply>
</tns:patch>
