<?xml version="1.0" encoding="UTF-8"?>
<tns:patch closeOnSuccess="true" retryOnFail="true"
	xmlns:tns="http://docs.ampdev.net/schemas/xmlpatcher" xmlns:xsi="http://www.w3.org/2001/XMLSchema-instance"
	xsi:schemaLocation="http://docs.ampdev.net/schemas/xmlpatcher ../../schemas/xmlpatcher.xsd ">
	<jira>AMP-16001</jira>
	<keyword>pledges</keyword>
	<author>Alex Gartner</author>
	<description>Adding pledges column to donor reports</description>
	<apply>
		<script>
			<lang delimiter=";" type="postgres">
				INSERT INTO amp_columns (columnId,columnName,aliasName,cellType,extractorView) VALUES 
		(nextval('amp_columns_seq'),'Activity Pledges Title','activity_pledges','org.dgfoundation.amp.ar.cell.TrnTextCell','v_activity_pledges_title');
		
			INSERT INTO amp_columns_order (id, columnname, indexorder) VALUES (nextval('amp_columns_order_seq'), 'Activity Pledges', (SELECT max(indexOrder) + 1 FROM amp_columns_order) );
			</lang>
		</script>
	</apply>
</tns:patch>
