<?xml version="1.0" encoding="UTF-8"?>
<tns:patch closeOnSuccess="true" retryOnFail="true" xmlns:tns="http://docs.ampdev.net/schemas/xmlpatcher" xmlns:xsi="http://www.w3.org/2001/XMLSchema-instance" xsi:schemaLocation="http://docs.ampdev.net/schemas/xmlpatcher ../doc/xmlpatcher.xsd ">
    <jira>AMP-12493</jira>
    <keyword>reports</keyword>
    <keyword>category manager</keyword>
    <author>Dare</author>
    <description>Adding category for reports</description>
    
    <trigger type="all">
	      <condition  type="entryInTableMissing" tablename="amp_category_class" columnname="keyName" columnvalue="report_category" />
	</trigger>
       <apply>
        <script>
            <lang  delimiter=";" type="postgres">

	INSERT INTO amp_category_class(id, category_name,is_multiselect,is_ordered, keyName) 
	VALUES((select max(id)+1 from amp_category_class), 'Report Categories', false, false, 'report_category');

	insert into amp_category_value (id, category_value, amp_category_class_id, index_column) 
	select (select max(id)+1 from amp_category_value) as id2, 'On budget', id, '0' 
		from amp_category_class where keyname='report_category';

	insert into amp_category_value (id, category_value, amp_category_class_id, index_column) 
	select (select max(id)+1 from amp_category_value) as id2, 'Off budget', id, '1' 
	from amp_category_class where keyname='report_category';

            </lang>
        </script>
    </apply>
</tns:patch>
