<?xml version="1.0" encoding="UTF-8"?>
<tns:patch closeOnSuccess="true" retryOnFail="true"
	xmlns:tns="http://docs.ampdev.net/schemas/xmlpatcher" xmlns:xsi="http://www.w3.org/2001/XMLSchema-instance"
	xsi:schemaLocation="http://docs.ampdev.net/schemas/xmlpatcher ../doc/xmlpatcher.xsd ">
	<jira>AMP-15844</jira>
	<keyword>Views</keyword>
	<author>Dolghier Constantin</author>
	<description>drop views for fields that are removed: component title and description</description>
	<apply>
		<script>
			<lang delimiter=";" type="postgres">
			
				DELETE FROM amp_report_column WHERE amp_report_id IN (
					SELECT DISTINCT(amp_report_id) FROM amp_report_column where columnid IN (
						SELECT columnid FROM amp_columns WHERE extractorview IN ('v_ssc_component_title', 'v_ssc_component_description')
					)
				);

				DELETE FROM amp_member_reports amr WHERE amr.amp_report_id IN
					(SELECT DISTINCT(amp_report_id) FROM amp_reports ar WHERE  
				(
					SELECT count(*) FROM amp_report_column rc WHERE rc.amp_report_id = ar.amp_report_id) = 0
				);

				DELETE FROM amp_report_log amr WHERE amr.amp_report_id IN
					(SELECT DISTINCT(amp_report_id) FROM amp_reports ar WHERE  
				(
					SELECT count(*) FROM amp_report_column rc WHERE rc.amp_report_id = ar.amp_report_id) = 0
				);

				DELETE FROM amp_team_reports amr WHERE amr.report IN
					(SELECT DISTINCT(amp_report_id) FROM amp_reports ar WHERE  
				(
					SELECT count(*) FROM amp_report_column rc WHERE rc.amp_report_id = ar.amp_report_id) = 0
				);

				DELETE FROM amp_report_measures amr WHERE amr.amp_report_id IN
					(SELECT DISTINCT(amp_report_id) FROM amp_reports ar WHERE  
				(
					SELECT count(*) FROM amp_report_column rc WHERE rc.amp_report_id = ar.amp_report_id) = 0
				);
				
				DELETE FROM amp_filter_data ar WHERE (SELECT count(*) FROM amp_report_column rc WHERE rc.amp_report_id = ar.amp_report_id) = 0;
				DELETE from amp_report_hierarchy arh WHERE NOT EXISTS (select * from amp_report_column arc WHERE arc.amp_report_id = arh.amp_report_id AND arc.columnid = arh.columnid);
				
				DELETE FROM amp_reports ar WHERE (
					SELECT count(*) FROM amp_report_column rc WHERE rc.amp_report_id = ar.amp_report_id) = 0;

                drop view if exists v_ssc_component_title;
                drop view if exists v_ssc_component_description;
			</lang>
		</script>
	</apply>
</tns:patch>
