<?xml version="1.0" encoding="UTF-8"?>
<tns:patch closeOnSuccess="false" retryOnFail="true"
	xmlns:tns="http://docs.ampdev.net/schemas/xmlpatcher" xmlns:xsi="http://www.w3.org/2001/XMLSchema-instance"
	xsi:schemaLocation="http://docs.ampdev.net/schemas/xmlpatcher ../doc/xmlpatcher.xsd ">
	<jira>AMP-13984</jira>
	<keyword>Views</keyword>
	<keyword>Agreement</keyword>
	<author>Alex</author>
	<description>Views for agreement ( title + code )</description>
	<trigger type="all">
		<condition type="custom">
			<script returnVar="val">
				<lang type="sql">
					SELECT settingsvalue FROM amp_global_settings where settingsname='Recreate the views on the next server restart';
				</lang>
			</script>
 			<test>val.equalsIgnoreCase("true")</test>
		</condition>
	</trigger> 
	<apply>
		<script>
			<lang delimiter=";" type="postgres">
					DROP VIEW IF EXISTS v_agreement_title_code;
			    	CREATE OR REPLACE VIEW v_agreement_title_code AS 
			    	SELECT DISTINCT f.amp_activity_id, ag.title || ' - ' || ag.code as "Agreement Title + Code", ag.id, ag.code AS "Agreement Code", o.name AS "Donor Agency", o.amp_org_id, ag.title as agreement_title 
			    	FROM amp_agreement ag, amp_funding f, amp_organisation o 
  					WHERE f.agreement = ag.id AND f.amp_donor_org_id = o.amp_org_id;
        		</lang>
		</script>
	</apply>
</tns:patch>
