<?xml version="1.0" encoding="UTF-8"?>
<tns:patch closeOnSuccess="true" retryOnFail="true"
           xmlns:tns="http://docs.ampdev.net/schemas/xmlpatcher" xmlns:xsi="http://www.w3.org/2001/XMLSchema-instance"
           xsi:schemaLocation="http://docs.ampdev.net/schemas/xmlpatcher ../../schemas/xmlpatcher.xsd ">
    <jira>AMP-30955</jira>
    <keyword>Change url to new report generator</keyword>
    <author>bmokandu</author>
    <description>Change Url for report generator.</description>
    <apply>
        <script>
            <lang delimiter=";" type="postgres">
                UPDATE amp_menu_entry SET url = '/TEMPLATE/reampv2/packages/container/build/index.html#/reampv2-app/report_generator?profile=R' WHERE url LIKE '/TEMPLATE/reampv2/build/index.html#/report_generator?profile=R';
                UPDATE amp_menu_entry SET url = '/TEMPLATE/reampv2/packages/container/build/index.html#/reampv2-app/report_generator?profile=R&amp;type=P' WHERE url LIKE '/TEMPLATE/reampv2/build/index.html#/report_generator?profile=R&amp;type=P';
                UPDATE amp_menu_entry SET url = '/TEMPLATE/reampv2/packages/container/build/index.html#/reampv2-app/report_generator?profile=T' WHERE url LIKE '/TEMPLATE/reampv2/build/index.html#/report_generator?profile=T';
            </lang>
        </script>
    </apply>
</tns:patch>
