<?xml version="1.0" encoding="UTF-8"?>
<tns:patch closeOnSuccess="true" retryOnFail="true" xmlns:tns="http://docs.ampdev.net/schemas/xmlpatcher" xmlns:xsi="http://www.w3.org/2001/XMLSchema-instance" xsi:schemaLocation="http://docs.ampdev.net/schemas/xmlpatcher ../doc/xmlpatcher.xsd ">
    <jira>AMP-25177</jira>
    <keyword>MTEF column name</keyword>
    <author>vchihai</author>
    <description>Rename MTEF column names with regexp</description>
    <apply>
        <script>
            <lang delimiter=";" type="postgres">


				UPDATE amp_columns SET aliasname = 'mtef' || (substring (columnname, '\d\d\d\d$')),
				tokenexpression = columnname,
				extractorview='v_mtef_funding',
				celltype = 'org.dgfoundation.amp.ar.cell.ComputedAmountCell'
				WHERE columnname ~'^MTEF \d\d\d\d$'
				AND aliasname is null
				AND tokenexpression is null
				AND extractorview = 'v_empty_text_column'
				AND celltype = 'org.dgfoundation.amp.ar.cell.TextCell';

            	DELETE FROM amp_columns 
            	WHERE columnname ~ '^(MTEF|Real MTEF|Projection MTEF Projections|Pipeline MTEF Projections) \d\d\d\d$' AND tokenexpression is null;
            	
            	UPDATE amp_columns 
            	SET columnname = regexp_replace(columnname, '[\/]\d\d\d\d$', ''), tokenexpression = regexp_replace(tokenexpression, '[\/]\d\d\d\d$', '') 
            	WHERE columnname ~ '^(MTEF|Real MTEF|Projection MTEF Projections|Pipeline MTEF Projections) \d\d\d\d[\/]\d\d\d\d$';
            	
            	UPDATE amp_columns 
            	SET tokenexpression = regexp_replace(tokenexpression, 'Real ', '') 
            	WHERE tokenexpression ~ '^(Real Projection MTEF Projections|Real Pipeline MTEF Projections) \d\d\d\d$';
            	
            	UPDATE amp_fields_visibility 
            	SET name = regexp_replace(name, '[\/]\d\d\d\d$', ''), description = regexp_replace(description, '[\/]\d\d\d\d$', '') 
            	WHERE name ~ '^(MTEF|Real MTEF|Projection MTEF Projections|Pipeline MTEF Projections) \d\d\d\d[\/]\d\d\d\d$';
            	
            	UPDATE amp_fields_visibility 
            	SET description = regexp_replace(name, 'Real ', '')
            	WHERE description ~ '^(Real Projection MTEF Projections|Real Pipeline MTEF Projections) \d\d\d\d$';
            </lang>
        </script>
    </apply>
</tns:patch>
